id,title,text,date,ip,browser,os
5a3a4942-da66-4340-a053-dcf80ad9433a,How-To-Use,GIVEN a note-taking application...,"2023-07-13T08:44:53.847Z",::1,"Chrome 114.0.0","Mac OS X 10.15.7"
90b261c4-5fae-4fc4-b660-f4280c61c283,ID,This Note Taker uses UUID v4...,"2023-07-13T09:07:43.476Z",::ffff:10.1.49.79,"Chrome 114.0.0","Mac OS X 10.15.7"
2bd25f1b-9dee-4e51-a86b-46d1b8b4fab7,UserAgent Package,This app also uses useragent package...,"2023-07-13T09:09:37.810Z",::ffff:10.1.34.55,"Chrome 114.0.0","Mac OS X 10.15.7"
acbc56c5-091c-4c6a-bd2b-f7d4b5338848,Date,This Note Taker also records...,"2023-07-13T09:12:09.242Z",::ffff:10.1.19.119,"Chrome 114.0.0","Mac OS X 10.15.7"
8746cce3-683c-48ca-9530-3fdcb095f341,NOTE API,To see the api for note stored...,"2023-07-13T09:20:05.005Z",::ffff:10.1.47.122,"Chrome 114.0.0","Mac OS X 10.15.7"
4e3b7009-f094-4e49-ac6f-79cb58e73ec4,DELETE IS SERVER WIDE,"When you click to delete a note...,"2023-07-14T06:36:07.936Z",::ffff:10.1.33.87,"Chrome 114.0.0","Windows 10.0.0"
364fac0a-d8c4-4168-ac77-0c02f7ec8783,Drag and Drop,"Don't like how the Note List is arranged?...,"2023-07-14T06:39:26.873Z",::ffff:10.1.33.87,"Chrome 114.0.0","Windows 10.0.0"
